Neighbourhood,Zipcode,Advertising,Trialsite
COLONIA REQUENA,03014,1,Hospital General Universitario de Alicante
VIRGEN DEL REMEDIO,03002,1,Centre de Salut Alacant Ciutat Jardí
SIDI IFNI - NOU ALACANT,03014,1,Centro de Salud Parque Lo Morant
JUAN XXIII,03015,1,Centro de Salud Parque Lo Morant
CIUDAD ELEGIDA,03015,1,Centro de Salud Parque Lo Morant
CAMPOAMOR,03189,1,Centre de Salut de Campoamor
PLAYA DE SAN JUAN,03540,1,Centro de Salud Cabo Huertas
ALBUFERETA,03016,1,Centro de Salud Cabo Huertas
CABO DE LAS HUERTAS,03540,1,Centro de Salud Cabo Huertas